{
  "schemaVersion": "0.1.0",
  "envelopeId": "CC-EN-QPCR-CREATION-001",
  "envelopeVersion": "0.1.0",
  "subject": {
    "recordType": "creation",
    "recordId": "CC-CP-QPCR-CREATOR-PROGRAMME-001",
    "recordVersion": "0.1.0"
  },
  "payload": {
    "ref": "examples/records/creation-passport.qpcr-programme.sample.json",
    "mediaType": "application/json",
    "canonicalization": "CC-CJSON-0.1",
    "digest": {
      "algorithm": "sha-256",
      "value": "fd09c2f02fd10d7bdfa3a200aab390794f495783ce74a2d8a8a8f66813cd66bd"
    }
  },
  "signatures": [
    {
      "signatureId": "SIG-QPCR-CREATION-DEMO-001",
      "signer": {
        "partyId": "CC-INST-CREATORS-COMMON",
        "name": "Creators Common",
        "partyType": "institution"
      },
      "algorithm": "synthetic-test",
      "keyRef": "keys/demo/not-a-production-key",
      "signatureValue": "SYNTHETIC-SIGNATURE-NOT-CRYPTOGRAPHICALLY-VALID",
      "signedAt": "2026-07-14T07:10:00Z",
      "verificationStatus": "unverified",
      "scope": "payload-digest"
    }
  ],
  "status": "draft",
  "issuer": {
    "issuerId": "CC-INST-CREATORS-COMMON",
    "name": "Creators Common",
    "authorityRef": "docs/architecture/CC-SIGNED-ENVELOPES-V0.1.md"
  },
  "createdAt": "2026-07-14T07:10:00Z",
  "updatedAt": "2026-07-14T07:10:00Z"
}
